aname,value,comment
articledates,Received 26 April 2022; Accepted 22 July 2022,Articledates for titlepage
volume,"2024, VOL. 2",Volume for title page top banner besides logo
copyright_year,"2024, VOL. 2",Year and other text to prepepend to footnote on title page
doi,https://doi.org/10.1000/182,DOI
pageheader,Muller et al. ,Author name for title page
article_type,Original research,"Article type for title page. One of Original research, Review, Comment ..."
has_abstract,yes,Whether the article is supposed to have an abstract
string_corresponding,Corresponding author,Text after * that indicates the corresponding author - *[text]:xx@gmail.com
